<?xml version="1.0"?>
<!DOCTYPE HPCToolkitExperiment [
<!-- ******************************************************************** -->
<!-- HPCToolkit Experiment DTD						  -->
<!-- Version 2.0							  -->
<!-- ******************************************************************** -->
<!ELEMENT HPCToolkitExperiment (Header, (SecCallPathProfile|SecFlatProfile)*)>
<!ATTLIST HPCToolkitExperiment
	  version CDATA #REQUIRED>

  <!-- ****************************************************************** -->

  <!-- Info/NV: flexible name-value pairs: (n)ame; (t)ype; (v)alue -->
  <!ELEMENT Info (NV*)>
  <!ATTLIST Info
	    n CDATA #IMPLIED>
  <!ELEMENT NV EMPTY>
  <!ATTLIST NV
	    n CDATA #REQUIRED
	    t CDATA #IMPLIED
	    v CDATA #REQUIRED>

  <!-- ****************************************************************** -->
  <!-- Header								  -->
  <!-- ****************************************************************** -->
  <!ELEMENT Header (Info*)>
  <!ATTLIST Header
	    n CDATA #REQUIRED>

  <!-- ****************************************************************** -->
  <!-- Section Header							  -->
  <!-- ****************************************************************** -->
  <!ELEMENT SecHeader (MetricTable?, MetricDBTable?, TraceDBTable?, LoadModuleTable?, FileTable?, ProcedureTable?, Info*)>

    <!-- MetricTable: -->
    <!ELEMENT MetricTable (Metric)*>

    <!-- Metric: (i)d; (n)ame -->
    <!--   (v)alue-type: transient type of values -->
    <!--   (t)ype: persistent type of metric -->
    <!--   fmt: format; show; -->
    <!ELEMENT Metric (MetricFormula*, Info?)>
    <!ATTLIST Metric
	      i            CDATA #REQUIRED
	      n            CDATA #REQUIRED
	      v            (raw|final|derived-incr|derived) "raw"
	      t            (inclusive|exclusive|nil) "nil"
	      partner      CDATA #IMPLIED
	      fmt          CDATA #IMPLIED
	      show         (1|0) "1"
	      show-percent (1|0) "1">

    <!-- MetricFormula represents derived metrics: (t)ype; (frm): formula -->
    <!ELEMENT MetricFormula (Info?)>
    <!ATTLIST MetricFormula
	      t   (combine|finalize) "finalize"
	      i   CDATA #IMPLIED
	      frm CDATA #REQUIRED>

    <!-- Metric data, used in sections: (n)ame [from Metric]; (v)alue -->
    <!ELEMENT M EMPTY>
    <!ATTLIST M
	      n CDATA #REQUIRED
	      v CDATA #REQUIRED>

    <!-- MetricDBTable: -->
    <!ELEMENT MetricDBTable (MetricDB)*>

    <!-- MetricDB: (i)d; (n)ame -->
    <!--   db-glob:        file glob describing files in metric db -->
    <!--   db-id:          id within metric db -->
    <!--   db-num-metrics: number of metrics in db -->
    <!--   db-header-sz:   size (in bytes) of a db file header -->
    <!ELEMENT MetricDB EMPTY>
    <!ATTLIST MetricDB
	      i              CDATA #REQUIRED
	      n              CDATA #REQUIRED
	      db-glob        CDATA #IMPLIED
	      db-id          CDATA #IMPLIED
	      db-num-metrics CDATA #IMPLIED
	      db-header-sz   CDATA #IMPLIED>

    <!-- TraceDBTable: -->
    <!ELEMENT TraceDBTable (TraceDB)>

    <!-- TraceDB: (i)d -->
    <!--   db-min-time: min beginning time stamp (global) -->
    <!--   db-max-time: max ending time stamp (global) -->
    <!ELEMENT TraceDB EMPTY>
    <!ATTLIST TraceDB
	      i            CDATA #REQUIRED
	      db-glob      CDATA #IMPLIED
	      db-min-time  CDATA #IMPLIED
	      db-max-time  CDATA #IMPLIED
	      db-header-sz CDATA #IMPLIED>

    <!-- LoadModuleTable assigns a short name to a load module -->
    <!ELEMENT LoadModuleTable (LoadModule)*>

    <!ELEMENT LoadModule (Info?)>
    <!ATTLIST LoadModule
	      i CDATA #REQUIRED
	      n CDATA #REQUIRED>

    <!-- FileTable assigns a short name to a file -->
    <!ELEMENT FileTable (File)*>

    <!ELEMENT File (Info?)>
    <!ATTLIST File
	      i CDATA #REQUIRED
	      n CDATA #REQUIRED>

    <!-- ProcedureTable assigns a short name to a procedure -->
    <!ELEMENT ProcedureTable (Procedure)*>

    <!ELEMENT Procedure (Info?)>
    <!ATTLIST Procedure
	      i CDATA #REQUIRED
	      n CDATA #REQUIRED>

  <!-- ****************************************************************** -->
  <!-- Section: Call path profile					  -->
  <!-- ****************************************************************** -->
  <!ELEMENT SecCallPathProfile (SecHeader, SecCallPathProfileData)>
  <!ATTLIST SecCallPathProfile
	    i CDATA #REQUIRED
	    n CDATA #REQUIRED>

    <!ELEMENT SecCallPathProfileData (PF|M)*>
      <!-- Procedure frame -->
      <!--   (i)d: unique identifier for cross referencing -->
      <!--   (s)tatic scope id -->
      <!--   (n)ame: a string or an id in ProcedureTable -->
      <!--   (lm) load module: a string or an id in LoadModuleTable -->
      <!--   (f)ile name: a string or an id in LoadModuleTable -->
      <!--   (l)ine range: "beg-end" (inclusive range) -->
      <!--   (a)lien: whether frame is alien to enclosing P -->
      <!--   (v)ma-range-set: "{[beg-end), [beg-end)...}" -->
      <!ELEMENT PF (PF|Pr|L|C|S|M)*>
      <!ATTLIST PF
		i  CDATA #IMPLIED
		s  CDATA #IMPLIED
		n  CDATA #REQUIRED
		lm CDATA #IMPLIED
		f  CDATA #IMPLIED
		l  CDATA #IMPLIED
		v  CDATA #IMPLIED>
      <!-- Procedure (static): GOAL: replace with 'P' -->
      <!ELEMENT Pr (Pr|L|C|S|M)*>
      <!ATTLIST Pr
                i  CDATA #IMPLIED
		s  CDATA #IMPLIED
                n  CDATA #REQUIRED
		lm CDATA #IMPLIED
		f  CDATA #IMPLIED
                l  CDATA #IMPLIED
		a  (1|0) "0"
		v  CDATA #IMPLIED>
      <!-- Callsite (a special StatementRange) -->
      <!ELEMENT C (PF|M)*>
      <!ATTLIST C
		i CDATA #IMPLIED
		s CDATA #IMPLIED
		l CDATA #IMPLIED
		v CDATA #IMPLIED>

  <!-- ****************************************************************** -->
  <!-- Section: Flat profile						  -->
  <!-- ****************************************************************** -->
  <!ELEMENT SecFlatProfile (SecHeader, SecFlatProfileData)>
  <!ATTLIST SecFlatProfile
	    i CDATA #REQUIRED
	    n CDATA #REQUIRED>

    <!ELEMENT SecFlatProfileData (LM|M)*>
      <!-- Load module: (i)d; (n)ame; (v)ma-range-set -->
      <!ELEMENT LM (F|P|M)*>
      <!ATTLIST LM
                i CDATA #IMPLIED
                n CDATA #REQUIRED
		v CDATA #IMPLIED>
      <!-- File -->
      <!ELEMENT F (P|L|S|M)*>
      <!ATTLIST F
                i CDATA #IMPLIED
                n CDATA #REQUIRED>
      <!-- Procedure (Note 1) -->
      <!ELEMENT P (P|A|L|S|C|M)*>
      <!ATTLIST P
                i CDATA #IMPLIED
                n CDATA #REQUIRED
                l CDATA #IMPLIED
		v CDATA #IMPLIED>
      <!-- Alien (Note 1) -->
      <!ELEMENT A (A|L|S|C|M)*>
      <!ATTLIST A
                i CDATA #IMPLIED
                f CDATA #IMPLIED
                n CDATA #IMPLIED
                l CDATA #IMPLIED
		v CDATA #IMPLIED>
      <!-- Loop (Note 1,2) -->
      <!ELEMENT L (A|Pr|L|S|C|M)*>
      <!ATTLIST L
		i CDATA #IMPLIED
		s CDATA #IMPLIED
		l CDATA #IMPLIED
	        f CDATA #IMPLIED
		v CDATA #IMPLIED>
      <!-- Statement (Note 2) -->
      <!--   (it): trace record identifier -->
      <!ELEMENT S (S|M)*>
      <!ATTLIST S
		i  CDATA #IMPLIED
		it CDATA #IMPLIED
		s  CDATA #IMPLIED
		l  CDATA #IMPLIED
		v  CDATA #IMPLIED>
      <!-- Note 1: Contained Cs may not contain PFs -->
      <!-- Note 2: The 's' attribute is not used for flat profiles -->
]>
<HPCToolkitExperiment version="2.0">
<Header n="test2">
  <Info/>
</Header>
<SecCallPathProfile i="0" n="test2">
<SecHeader>
  <MetricTable>
    <Metric i="18" n="REALTIME (usec):Sum (I)" v="derived-incr" t="inclusive" partner="19" show="1" show-percent="1">
      <MetricFormula t="combine" frm="sum($18, $18)"/>
      <MetricFormula t="finalize" frm="$18"/>
      <Info><NV n="units" v="events"/></Info>
    </Metric>
    <Metric i="19" n="REALTIME (usec):Sum (E)" v="derived-incr" t="exclusive" partner="18" show="1" show-percent="1">
      <MetricFormula t="combine" frm="sum($19, $19)"/>
      <MetricFormula t="finalize" frm="$19"/>
      <Info><NV n="units" v="events"/></Info>
    </Metric>
  </MetricTable>
  <MetricDBTable>
  </MetricDBTable>
  <TraceDBTable>
    <TraceDB i="0" db-glob="*.hpctrace" db-min-time="1472443264697170" db-max-time="1472443269319901" db-header-sz="32"/>
  </TraceDBTable>
  <LoadModuleTable>
    <LoadModule i="2" n="/global/u2/h/hashim/GitLab/ALLVM/openMP_exp/build/test2"/>
  </LoadModuleTable>
  <FileTable>
    <File i="57733" n="/usr/src/packages/BUILD/glibc-2.11.3/misc/../sysdeps/unix/sysv/linux/getsysstats.c"/>
    <File i="59075" n="/usr/src/packages/BUILD/glibc-2.11.3/nptl/../nptl/sysdeps/unix/sysv/linux/x86_64/pthread_cond_timedwait.S"/>
    <File i="59682" n="/usr/src/packages/BUILD/glibc-2.11.3/nptl/../sysdeps/unix/syscall-template.S"/>
    <File i="63050" n="/usr/src/packages/BUILD/glibc-2.11.3/posix/../sysdeps/unix/syscall-template.S"/>
    <File i="63171" n="/usr/src/packages/BUILD/glibc-2.11.3/posix/../sysdeps/unix/sysv/linux/x86_64/sysconf.c"/>
    <File i="63178" n="../sysdeps/unix/sysv/linux/x86_64/sysconf.c"/>
    <File i="63204" n="../sysdeps/unix/sysv/linux/x86_64/../sysconf.c"/>
    <File i="63206" n="/usr/src/packages/BUILD/glibc-2.11.3/posix/../sysdeps/posix/sysconf.c"/>
    <File i="85116" n="kmp_barrier.o"/>
    <File i="85805" n="kmp_runtime.o"/>
    <File i="92411" n="z_Linux_util.o"/>
    <File i="92521" n="~unknown-file~"/>
    <File i="92679" n=""/>
    <File i="92857" n=""/>
    <File i="92858" n=""/>
    <File i="93117" n=""/>
    <File i="93118" n=""/>
    <File i="94747" n=""/>
    <File i="94748" n=""/>
    <File i="95153" n=""/>
    <File i="95155" n=""/>
    <File i="95172" n=""/>
    <File i="95174" n=""/>
    <File i="95283" n=""/>
    <File i="95790" n="z_Linux_asm.o"/>
    <File i="95835" n=""/>
    <File i="95836" n=""/>
    <File i="95863" n=""/>
    <File i="95864" n=""/>
    <File i="95873" n=""/>
    <File i="96695" n=""/>
    <File i="97191" n=""/>
    <File i="97355" n=""/>
    <File i="99169" n=""/>
    <File i="99363" n=""/>
    <File i="99917" n=""/>
  </FileTable>
  <ProcedureTable>
    <Procedure i="57734" n="next_line"/>
    <Procedure i="57768" n="__get_nprocs"/>
    <Procedure i="59076" n="__pthread_cond_timedwait"/>
    <Procedure i="59723" n="__read_nocancel"/>
    <Procedure i="63092" n="__sched_yield"/>
    <Procedure i="63172" n="__sysconf"/>
    <Procedure i="63178" n=""/>
    <Procedure i="63204" n="linux_sysconf"/>
    <Procedure i="63205" n=""/>
    <Procedure i="63206" n="posix_sysconf"/>
    <Procedure i="85173" n="__kmp_hyper_barrier_gather(barrier_type, kmp_info*, int, int, void (*)(void*, void*), void*)"/>
    <Procedure i="85187" n="__kmp_hyper_barrier_release(barrier_type, kmp_info*, int, int, int, void*)"/>
    <Procedure i="85850" n="__kmp_do_serial_initialize()"/>
    <Procedure i="92421" n="__kmp_launch_monitor(void*)"/>
    <Procedure i="92479" n="__kmp_launch_worker(void*)"/>
    <Procedure i="92527" n="___kmp_allocate"/>
    <Procedure i="92678" n="__kmp_acquire_queuing_lock"/>
    <Procedure i="92689" n="__kmp_acquire_ticket_lock"/>
    <Procedure i="92856" n="__kmp_allocate_team"/>
    <Procedure i="92926" n="__kmp_allocate_thread"/>
    <Procedure i="93114" n="__kmp_barrier"/>
    <Procedure i="93763" n="__kmp_eq_4"/>
    <Procedure i="94746" n="__kmp_external___intel_memset"/>
    <Procedure i="95148" n="__kmp_fork_barrier(int, int)"/>
    <Procedure i="95170" n="__kmp_fork_call"/>
    <Procedure i="95278" n="__kmp_get_global_thread_id_reg"/>
    <Procedure i="95457" n="__kmp_init_implicit_task"/>
    <Procedure i="95789" n="__kmp_invoke_microtask"/>
    <Procedure i="95790" n="L_kmp_invoke_pass_parms"/>
    <Procedure i="95797" n="__kmp_invoke_task_func"/>
    <Procedure i="95832" n="__kmp_join_barrier(int)"/>
    <Procedure i="95858" n="__kmp_join_call"/>
    <Procedure i="95872" n="__kmp_launch_thread"/>
    <Procedure i="96694" n="__kmp_release_queuing_lock"/>
    <Procedure i="96702" n="__kmp_release_ticket_lock"/>
    <Procedure i="96849" n="__kmp_runtime_initialize"/>
    <Procedure i="97180" n="__kmp_task_team_setup"/>
    <Procedure i="97186" n="__kmp_task_team_sync"/>
    <Procedure i="97190" n="__kmp_task_team_wait"/>
    <Procedure i="97353" n="__kmp_wait_yield_4"/>
    <Procedure i="97375" n="__kmp_yield"/>
    <Procedure i="99123" n="__kmpc_barrier"/>
    <Procedure i="99164" n="__kmpc_critical"/>
    <Procedure i="99362" n="__kmpc_end_critical"/>
    <Procedure i="99410" n="__kmpc_for_static_fini"/>
    <Procedure i="99412" n="__kmpc_for_static_init_4"/>
    <Procedure i="99432" n="__kmpc_fork_call"/>
    <Procedure i="99912" n="main"/>
  </ProcedureTable>
  <Info/>
</SecHeader>
<SecCallPathProfileData>
<M n="18" v="4.1064e+07"/>
<PF i="2" s="92421" l="0" lm="2" f="92411" n="92421">
<M n="18" v="4.58026e+06"/>
<L i="3" s="92433" l="0" f="92411">
<M n="18" v="4.58026e+06"/>
<C i="4" s="92437" l="0">
<M n="18" v="4.58026e+06"/>
<PF i="5" s="59076" l="53" lm="2" f="59075" n="59076">
<M n="18" v="4.58026e+06"/><M n="19" v="4.58026e+06"/>
<S i="6" s="59077" l="53" it="145"/>
<L i="7" s="59112" l="273" f="59075">
<M n="18" v="4.58026e+06"/><M n="19" v="4.58026e+06"/>
<S i="8" s="59155" l="234">
<M n="18" v="4.58026e+06"/><M n="19" v="4.58026e+06"/>
</S>
</L>
</PF>
</C>
</L>
</PF>
<PF i="9" s="92479" l="0" lm="2" f="92411" n="92479">
<M n="18" v="3.18907e+07"/>
<C i="10" s="92494" l="0">
<M n="18" v="3.18907e+07"/>
<PF i="11" s="95872" l="0" lm="2" f="92521" n="95872">
<M n="18" v="3.18907e+07"/><M n="19" v="3003"/>
<L i="12" s="95873" l="0" f="95873">
<M n="18" v="3.18907e+07"/><M n="19" v="3003"/>
<S i="13" s="95874" l="0" it="1979">
<M n="18" v="3003"/><M n="19" v="3003"/>
</S>
<C i="14" s="95875" l="0">
<M n="18" v="1.34842e+06"/>
<PF i="15" s="95148" l="0" lm="2" f="92521" n="95148">
<M n="18" v="1.34842e+06"/><M n="19" v="4004"/>
<L i="16" s="95153" l="0" f="95153">
<M n="18" v="4004"/>
<L i="17" s="95155" l="0" f="95155">
<M n="18" v="4004"/><M n="19" v="4004"/>
<S i="18" s="95156" l="0" it="2081">
<M n="18" v="4004"/><M n="19" v="4004"/>
</S>
</L>
</L>
<C i="19" s="95164" l="0">
<M n="18" v="1.34142e+06"/>
<PF i="20" s="85187" l="0" lm="2" f="85116" n="85187">
<M n="18" v="1.34142e+06"/><M n="19" v="1.31038e+06"/>
<L i="21" s="85188" l="0" f="85116">
<M n="18" v="1.33141e+06"/><M n="19" v="48048"/>
<C i="22" s="85189" l="0">
<M n="18" v="21023"/>
<PF i="23" s="97375" l="0" lm="2" f="92521" n="97375">
<M n="18" v="21023"/><M n="19" v="21023"/>
<S i="24" s="97376" l="0" it="1301">
<M n="18" v="21023"/><M n="19" v="21023"/>
</S>
</PF>
</C>
<S i="25" s="85189" l="0">
<M n="18" v="48048"/><M n="19" v="48048"/>
</S>
<C i="26" s="85190" l="0">
<M n="18" v="1001"/>
<PF i="27" s="63092" l="82" lm="2" f="63050" n="63092">
<M n="18" v="1001"/><M n="19" v="1001"/>
<S i="28" s="63094" l="82" it="1855">
<M n="18" v="1001"/><M n="19" v="1001"/>
</S>
</PF>
</C>
<L i="29" s="85192" l="0" f="85116">
<M n="18" v="1.26134e+06"/>
<L i="30" s="85193" l="0" f="85116">
<M n="18" v="1.26134e+06"/><M n="19" v="1.26134e+06"/>
<S i="31" s="85194" l="0" it="689">
<M n="18" v="1.26134e+06"/><M n="19" v="1.26134e+06"/>
</S>
</L>
</L>
</L>
<C i="32" s="85200" l="0">
<M n="18" v="9008"/>
<PF i="33" s="95457" l="0" lm="2" f="92521" n="95457">
<M n="18" v="9008"/><M n="19" v="9008"/>
<S i="34" s="95458" l="0" it="2111">
<M n="18" v="9008"/><M n="19" v="9008"/>
</S>
</PF>
</C>
<S i="35" s="85200" l="0">
<M n="18" v="1001"/><M n="19" v="1001"/>
</S>
</PF>
</C>
<C i="36" s="95166" l="0">
<M n="18" v="3003"/>
<PF i="37" s="97186" l="0" lm="2" f="92521" n="97186">
<M n="18" v="3003"/><M n="19" v="3003"/>
<S i="38" s="97187" l="0" it="2121">
<M n="18" v="3003"/><M n="19" v="3003"/>
</S>
</PF>
</C>
</PF>
</C>
<C i="39" s="95879" l="0">
<M n="18" v="3.03491e+07"/>
<PF i="40" s="95797" l="0" lm="2" f="92521" n="95797">
<M n="18" v="3.03491e+07"/><M n="19" v="1001"/>
<S i="41" s="95798" l="0" it="2399">
<M n="18" v="1001"/><M n="19" v="1001"/>
</S>
<C i="42" s="95800" l="0">
<M n="18" v="3.03481e+07"/>
<PF i="43" s="95789" l="0" lm="2" f="92521" n="95789">
<M n="18" v="3.03481e+07"/><M n="19" v="2003"/>
<Pr i="44" s="95790" l="0" lm="2" f="95790" n="95790" a="1">
<M n="18" v="3.03481e+07"/><M n="19" v="2003"/>
<S i="45" s="95791" l="0">
<M n="18" v="2003"/><M n="19" v="2003"/>
</S>
<C i="46" s="95792" l="0">
<M n="18" v="3.03461e+07"/>
<PF i="47" s="99912" l="0" lm="2" f="92521" n="99912">
<M n="18" v="3.03461e+07"/><M n="19" v="2.77301e+07"/>
<L i="48" s="99917" l="0" f="99917">
<M n="18" v="2.77261e+07"/><M n="19" v="2.77261e+07"/>
<S i="49" s="99918" l="0" it="439">
<M n="18" v="2.77261e+07"/><M n="19" v="2.77261e+07"/>
</S>
</L>
<C i="50" s="99927" l="0">
<M n="18" v="29030"/>
<PF i="51" s="99412" l="0" lm="2" f="92521" n="99412">
<M n="18" v="29030"/><M n="19" v="29030"/>
<S i="52" s="99413" l="0" it="1631">
<M n="18" v="29030"/><M n="19" v="29030"/>
</S>
</PF>
</C>
<C i="53" s="99928" l="0">
<M n="18" v="1001"/>
<PF i="54" s="99410" l="0" lm="2" f="92521" n="99410">
<M n="18" v="1001"/><M n="19" v="1001"/>
<S i="55" s="99411" l="0" it="1457">
<M n="18" v="1001"/><M n="19" v="1001"/>
</S>
</PF>
</C>
<C i="56" s="99929" l="0">
<M n="18" v="1.51368e+06"/>
<PF i="57" s="99123" l="0" lm="2" f="92521" n="99123">
<M n="18" v="1.51368e+06"/><M n="19" v="1001"/>
<S i="58" s="99124" l="0" it="1239">
<M n="18" v="1001"/><M n="19" v="1001"/>
</S>
<C i="59" s="99126" l="0">
<M n="18" v="1.51268e+06"/>
<PF i="60" s="93114" l="0" lm="2" f="92521" n="93114">
<M n="18" v="1.51268e+06"/><M n="19" v="13016"/>
<L i="61" s="93117" l="0" f="93117">
<M n="18" v="11012"/>
<L i="62" s="93118" l="0" f="93118">
<M n="18" v="11012"/><M n="19" v="11012"/>
<S i="63" s="93119" l="0" it="1821">
<M n="18" v="11012"/><M n="19" v="11012"/>
</S>
</L>
</L>
<C i="64" s="93145" l="0">
<M n="18" v="103110"/>
<PF i="65" s="85173" l="0" lm="2" f="85116" n="85173">
<M n="18" v="103110"/><M n="19" v="102109"/>
<L i="66" s="85174" l="0" f="85116">
<M n="18" v="103110"/>
<L i="67" s="85175" l="0" f="85116">
<M n="18" v="103110"/>
<L i="68" s="85176" l="0" f="85116">
<M n="18" v="103110"/><M n="19" v="102109"/>
<S i="69" s="85177" l="0" it="1007">
<M n="18" v="102109"/><M n="19" v="102109"/>
</S>
<C i="70" s="85178" l="0">
<M n="18" v="1001"/>
<PF i="71" s="97375" l="0" lm="2" f="92521" n="97375">
<M n="18" v="1001"/><M n="19" v="1001"/>
<S i="72" s="97376" l="0" it="219">
<M n="18" v="1001"/><M n="19" v="1001"/>
</S>
</PF>
</C>
</L>
</L>
</L>
</PF>
</C>
<S i="73" s="93145" l="0">
<M n="18" v="2004"/><M n="19" v="2004"/>
</S>
<C i="74" s="93152" l="0">
<M n="18" v="1.38353e+06"/>
<PF i="75" s="85187" l="0" lm="2" f="85116" n="85187">
<M n="18" v="1.38353e+06"/><M n="19" v="1.37152e+06"/>
<L i="76" s="85188" l="0" f="85116">
<M n="18" v="1.38353e+06"/><M n="19" v="50058"/>
<C i="77" s="85189" l="0">
<M n="18" v="11013"/>
<PF i="78" s="97375" l="0" lm="2" f="92521" n="97375">
<M n="18" v="11013"/><M n="19" v="11013"/>
<S i="79" s="97376" l="0" it="1425">
<M n="18" v="11013"/><M n="19" v="11013"/>
</S>
</PF>
</C>
<S i="80" s="85189" l="0">
<M n="18" v="50058"/><M n="19" v="50058"/>
</S>
<C i="81" s="85190" l="0">
<M n="18" v="1001"/>
<PF i="82" s="63092" l="82" lm="2" f="63050" n="63092">
<M n="18" v="1001"/><M n="19" v="1001"/>
<S i="83" s="63094" l="82" it="1911">
<M n="18" v="1001"/><M n="19" v="1001"/>
</S>
</PF>
</C>
<L i="84" s="85192" l="0" f="85116">
<M n="18" v="1.32146e+06"/>
<L i="85" s="85193" l="0" f="85116">
<M n="18" v="1.32146e+06"/><M n="19" v="1.32146e+06"/>
<S i="86" s="85194" l="0" it="259">
<M n="18" v="1.32146e+06"/><M n="19" v="1.32146e+06"/>
</S>
</L>
</L>
</L>
</PF>
</C>
<C i="87" s="93153" l="0">
<M n="18" v="13017"/>
<PF i="88" s="97186" l="0" lm="2" f="92521" n="97186">
<M n="18" v="13017"/><M n="19" v="13017"/>
<S i="89" s="97187" l="0" it="2357">
<M n="18" v="13017"/><M n="19" v="13017"/>
</S>
</PF>
</C>
</PF>
</C>
</PF>
</C>
<C i="90" s="99930" l="0">
<M n="18" v="984129"/>
<PF i="91" s="99164" l="0" lm="2" f="92521" n="99164">
<M n="18" v="984129"/><M n="19" v="3004"/>
<L i="92" s="99169" l="0" f="99169">
<M n="18" v="3004"/><M n="19" v="3004"/>
<S i="93" s="99170" l="0" it="1883">
<M n="18" v="3004"/><M n="19" v="3004"/>
</S>
</L>
<C i="94" s="99173" l="0">
<M n="18" v="981125"/>
<PF i="95" s="92678" l="0" lm="2" f="92521" n="92678">
<M n="18" v="394483"/><M n="19" v="394483"/>
<L i="96" s="92679" l="0" f="92679">
<M n="18" v="394483"/><M n="19" v="394483"/>
<S i="97" s="92680" l="0" it="885">
<M n="18" v="394483"/><M n="19" v="394483"/>
</S>
</L>
</PF>
<PF i="98" s="97353" l="0" lm="2" f="92521" n="97353">
<M n="18" v="586642"/><M n="19" v="522565"/>
<C i="99" s="97354" l="0">
<M n="18" v="1001"/>
<PF i="100" s="93763" l="0" lm="2" f="92521" n="93763">
<M n="18" v="1001"/><M n="19" v="1001"/>
<S i="101" s="93764" l="0" it="1405">
<M n="18" v="1001"/><M n="19" v="1001"/>
</S>
</PF>
</C>
<S i="102" s="97354" l="0">
<M n="18" v="1001"/><M n="19" v="1001"/>
</S>
<L i="103" s="97355" l="0" f="97355">
<M n="18" v="584640"/><M n="19" v="521564"/>
<S i="104" s="97356" l="0" it="821">
<M n="18" v="521564"/><M n="19" v="521564"/>
</S>
<C i="105" s="97357" l="0">
<M n="18" v="7008"/>
<PF i="106" s="97375" l="0" lm="2" f="92521" n="97375">
<M n="18" v="7008"/><M n="19" v="7008"/>
<S i="107" s="97376" l="0" it="2239">
<M n="18" v="7008"/><M n="19" v="7008"/>
</S>
</PF>
</C>
<C i="108" s="97359" l="0">
<M n="18" v="56068"/>
<PF i="109" s="93763" l="0" lm="2" f="92521" n="93763">
<M n="18" v="56068"/><M n="19" v="56068"/>
<S i="110" s="93764" l="0" it="947">
<M n="18" v="56068"/><M n="19" v="56068"/>
</S>
</PF>
</C>
</L>
</PF>
</C>
</PF>
</C>
<C i="111" s="99931" l="0">
<M n="18" v="88100"/>
<PF i="112" s="96694" l="0" lm="2" f="92521" n="96694">
<M n="18" v="83095"/><M n="19" v="62073"/>
<L i="113" s="96695" l="0" f="96695">
<M n="18" v="62073"/><M n="19" v="62073"/>
<S i="114" s="96696" l="0" it="1069">
<M n="18" v="62073"/><M n="19" v="62073"/>
</S>
</L>
<C i="115" s="96697" l="0">
<M n="18" v="21022"/>
<PF i="116" s="97353" l="0" lm="2" f="92521" n="97353">
<M n="18" v="21022"/><M n="19" v="21022"/>
<L i="117" s="97355" l="0" f="97355">
<M n="18" v="21022"/><M n="19" v="21022"/>
<S i="118" s="97356" l="0" it="1839">
<M n="18" v="21022"/><M n="19" v="21022"/>
</S>
</L>
</PF>
</C>
</PF>
<PF i="119" s="99362" l="0" lm="2" f="92521" n="99362">
<M n="18" v="5005"/><M n="19" v="5005"/>
<L i="120" s="99363" l="0" f="99363">
<M n="18" v="5005"/><M n="19" v="5005"/>
<S i="121" s="99364" l="0" it="2263">
<M n="18" v="5005"/><M n="19" v="5005"/>
</S>
</L>
</PF>
</C>
<S i="122" s="99931" l="0">
<M n="18" v="4004"/><M n="19" v="4004"/>
</S>
</PF>
</C>
</Pr>
<S i="123" s="95796" l="0" it="933"/>
</PF>
</C>
</PF>
</C>
<C i="124" s="95881" l="0">
<M n="18" v="190196"/>
<PF i="125" s="95832" l="0" lm="2" f="92521" n="95832">
<M n="18" v="190196"/><M n="19" v="4005"/>
<L i="126" s="95835" l="0" f="95835">
<M n="18" v="4005"/>
<L i="127" s="95836" l="0" f="95836">
<M n="18" v="4005"/><M n="19" v="4005"/>
<S i="128" s="95837" l="0" it="1799">
<M n="18" v="4005"/><M n="19" v="4005"/>
</S>
</L>
</L>
<C i="129" s="95855" l="0">
<M n="18" v="186191"/>
<PF i="130" s="85173" l="0" lm="2" f="85116" n="85173">
<M n="18" v="186191"/><M n="19" v="184189"/>
<L i="131" s="85174" l="0" f="85116">
<M n="18" v="186191"/>
<L i="132" s="85175" l="0" f="85116">
<M n="18" v="186191"/>
<L i="133" s="85176" l="0" f="85116">
<M n="18" v="186191"/><M n="19" v="184189"/>
<S i="134" s="85177" l="0" it="1791">
<M n="18" v="184189"/><M n="19" v="184189"/>
</S>
<C i="135" s="85178" l="0">
<M n="18" v="2002"/>
<PF i="136" s="97375" l="0" lm="2" f="92521" n="97375">
<M n="18" v="2002"/><M n="19" v="2002"/>
<S i="137" s="97376" l="0" it="1689">
<M n="18" v="2002"/><M n="19" v="2002"/>
</S>
</PF>
</C>
</L>
</L>
</L>
</PF>
</C>
</PF>
</C>
</L>
</PF>
</C>
</PF>
<PF i="138" s="99912" l="0" lm="2" f="92521" n="99912">
<M n="18" v="4.59307e+06"/>
<C i="139" s="99915" l="0">
<M n="18" v="3955"/>
<PF i="140" s="95278" l="0" lm="2" f="92521" n="95278">
<M n="18" v="3955"/>
<C i="141" s="95289" l="0">
<M n="18" v="3955"/>
<PF i="142" s="85850" l="0" lm="2" f="85805" n="85850">
<M n="18" v="3955"/>
<C i="143" s="85896" l="0">
<M n="18" v="3955"/>
<PF i="144" s="96849" l="0" lm="2" f="92521" n="96849">
<M n="18" v="3955"/>
<C i="145" s="96852" l="0">
<M n="18" v="3955"/>
<PF i="146" s="63172" l="33" lm="2" f="63171" n="63172">
<M n="18" v="3955"/>
<Pr i="147" s="63178" l="37" lm="2" f="63178" n="63178" a="1">
<M n="18" v="3955"/>
<Pr i="148" s="63204" l="136" lm="2" f="63204" n="63204" a="1">
<M n="18" v="3955"/>
<Pr i="149" s="63205" l="136" lm="2" f="63204" n="63205" a="1">
<M n="18" v="3955"/>
<Pr i="150" s="63206" l="54" lm="2" f="63206" n="63206" a="1">
<M n="18" v="3955"/>
<C i="151" s="63222" l="631">
<M n="18" v="3955"/>
<PF i="152" s="57768" l="130" lm="2" f="57733" n="57768">
<M n="18" v="3955"/>
<L i="153" s="57781" l="158" f="57733">
<M n="18" v="3955"/>
<C i="154" s="57783" l="152">
<M n="18" v="3955"/>
<PF i="155" s="57734" l="78" lm="2" f="57733" n="57734">
<M n="18" v="3955"/>
<C i="156" s="57747" l="91">
<M n="18" v="3955"/>
<PF i="157" s="59723" l="82" lm="2" f="59682" n="59723">
<M n="18" v="3955"/><M n="19" v="3955"/>
<S i="158" s="59725" l="82" it="37">
<M n="18" v="3955"/><M n="19" v="3955"/>
</S>
</PF>
</C>
</PF>
</C>
</L>
</PF>
</C>
</Pr>
</Pr>
</Pr>
</Pr>
</PF>
</C>
</PF>
</C>
</PF>
</C>
</PF>
</C>
<L i="159" s="99917" l="0" f="99917">
<M n="18" v="4.58912e+06"/>
<C i="160" s="99920" l="0">
<M n="18" v="4.58912e+06"/>
<PF i="161" s="99432" l="0" lm="2" f="92521" n="99432">
<M n="18" v="4.58912e+06"/>
<C i="162" s="99434" l="0">
<M n="18" v="1002"/>
<PF i="163" s="95278" l="0" lm="2" f="92521" n="95278">
<M n="18" v="1002"/><M n="19" v="1002"/>
<L i="164" s="95283" l="0" f="95283">
<M n="18" v="1002"/><M n="19" v="1002"/>
<S i="165" s="95284" l="0" it="1739">
<M n="18" v="1002"/><M n="19" v="1002"/>
</S>
</L>
</PF>
</C>
<C i="166" s="99435" l="0">
<M n="18" v="4.44192e+06"/>
<PF i="167" s="95170" l="0" lm="2" f="92521" n="95170">
<M n="18" v="4.44192e+06"/><M n="19" v="16022"/>
<L i="168" s="95172" l="0" f="95172">
<M n="18" v="16022"/>
<L i="169" s="95174" l="0" f="95174">
<M n="18" v="16022"/><M n="19" v="16022"/>
<S i="170" s="95175" l="0" it="921">
<M n="18" v="16022"/><M n="19" v="16022"/>
</S>
</L>
</L>
<C i="171" s="95192" l="0">
<M n="18" v="1002"/>
<PF i="172" s="92689" l="0" lm="2" f="92521" n="92689">
<M n="18" v="1002"/><M n="19" v="1002"/>
<S i="173" s="92690" l="0" it="2133">
<M n="18" v="1002"/><M n="19" v="1002"/>
</S>
</PF>
</C>
<C i="174" s="95203" l="0">
<M n="18" v="2002"/>
<PF i="175" s="96702" l="0" lm="2" f="92521" n="96702">
<M n="18" v="2002"/><M n="19" v="2002"/>
<S i="176" s="96703" l="0" it="1849">
<M n="18" v="2002"/><M n="19" v="2002"/>
</S>
</PF>
</C>
<C i="177" s="95206" l="0">
<M n="18" v="45060"/>
<PF i="178" s="95148" l="0" lm="2" f="92521" n="95148">
<M n="18" v="45060"/><M n="19" v="3005"/>
<C i="179" s="95149" l="0">
<M n="18" v="2002"/>
<PF i="180" s="97180" l="0" lm="2" f="92521" n="97180">
<M n="18" v="2002"/><M n="19" v="2002"/>
<S i="181" s="97181" l="0" it="1609">
<M n="18" v="2002"/><M n="19" v="2002"/>
</S>
</PF>
</C>
<L i="182" s="95153" l="0" f="95153">
<M n="18" v="3005"/>
<L i="183" s="95155" l="0" f="95155">
<M n="18" v="3005"/><M n="19" v="3005"/>
<S i="184" s="95156" l="0" it="2353">
<M n="18" v="3005"/><M n="19" v="3005"/>
</S>
</L>
</L>
<C i="185" s="95164" l="0">
<M n="18" v="40053"/>
<PF i="186" s="85187" l="0" lm="2" f="85116" n="85187">
<M n="18" v="40053"/><M n="19" v="40053"/>
<L i="187" s="85188" l="0" f="85116">
<M n="18" v="40053"/>
<L i="188" s="85192" l="0" f="85116">
<M n="18" v="40053"/>
<L i="189" s="85193" l="0" f="85116">
<M n="18" v="40053"/><M n="19" v="40053"/>
<S i="190" s="85194" l="0" it="477">
<M n="18" v="40053"/><M n="19" v="40053"/>
</S>
</L>
</L>
</L>
</PF>
</C>
</PF>
</C>
<C i="191" s="95207" l="0">
<M n="18" v="4.36981e+06"/>
<PF i="192" s="95797" l="0" lm="2" f="92521" n="95797">
<M n="18" v="4.36981e+06"/>
<C i="193" s="95800" l="0">
<M n="18" v="4.36981e+06"/>
<PF i="194" s="95789" l="0" lm="2" f="92521" n="95789">
<M n="18" v="4.36981e+06"/><M n="19" v="1002"/>
<Pr i="195" s="95790" l="0" lm="2" f="95790" n="95790" a="1">
<M n="18" v="4.36981e+06"/><M n="19" v="1002"/>
<S i="196" s="95791" l="0">
<M n="18" v="1002"/><M n="19" v="1002"/>
</S>
<C i="197" s="95792" l="0">
<M n="18" v="4.36881e+06"/>
<PF i="198" s="99912" l="0" lm="2" f="92521" n="99912">
<M n="18" v="4.36881e+06"/><M n="19" v="3.9863e+06"/>
<L i="199" s="99917" l="0" f="99917">
<M n="18" v="3.9863e+06"/><M n="19" v="3.9863e+06"/>
<S i="200" s="99918" l="0" it="415">
<M n="18" v="3.9863e+06"/><M n="19" v="3.9863e+06"/>
</S>
</L>
<C i="201" s="99927" l="0">
<M n="18" v="1001"/>
<PF i="202" s="99412" l="0" lm="2" f="92521" n="99412">
<M n="18" v="1001"/><M n="19" v="1001"/>
<S i="203" s="99413" l="0" it="2281">
<M n="18" v="1001"/><M n="19" v="1001"/>
</S>
</PF>
</C>
<C i="204" s="99929" l="0">
<M n="18" v="253334"/>
<PF i="205" s="99123" l="0" lm="2" f="92521" n="99123">
<M n="18" v="253334"/><M n="19" v="1002"/>
<S i="206" s="99124" l="0" it="2489">
<M n="18" v="1002"/><M n="19" v="1002"/>
</S>
<C i="207" s="99126" l="0">
<M n="18" v="252332"/>
<PF i="208" s="93114" l="0" lm="2" f="92521" n="93114">
<M n="18" v="252332"/><M n="19" v="3003"/>
<L i="209" s="93117" l="0" f="93117">
<M n="18" v="3003"/>
<L i="210" s="93118" l="0" f="93118">
<M n="18" v="3003"/><M n="19" v="3003"/>
<S i="211" s="93119" l="0" it="1159">
<M n="18" v="3003"/><M n="19" v="3003"/>
</S>
</L>
</L>
<C i="212" s="93145" l="0">
<M n="18" v="215275"/>
<PF i="213" s="85173" l="0" lm="2" f="85116" n="85173">
<M n="18" v="215275"/><M n="19" v="212271"/>
<L i="214" s="85174" l="0" f="85116">
<M n="18" v="215275"/>
<L i="215" s="85175" l="0" f="85116">
<M n="18" v="215275"/>
<L i="216" s="85176" l="0" f="85116">
<M n="18" v="215275"/><M n="19" v="212271"/>
<S i="217" s="85177" l="0" it="131">